{
  "binding": {
    "commit": "9aea8598b231ae85a70a478f37682a9b7a17f024",
    "contracts": {
      "count": 279,
      "files": [
        {
          "byte_size": 3823,
          "path": "contracts/agent-context-envelope.v1.schema.json",
          "sha256": "477fc7b8b0010ccd81f81c2d79fd0d6fcaa1dc6ca657d8d427fefdc8202e2a8a"
        },
        {
          "byte_size": 702,
          "path": "contracts/authoritative-challenge-replay.v1.schema.json",
          "sha256": "5b5b19df3212f0b66b6b0b249b751abf45d1f6032fe7a7ad7ec9a388a14feefa"
        },
        {
          "byte_size": 3419,
          "path": "contracts/authoritative-challenge-trace.v1.schema.json",
          "sha256": "3ed4ce9360362650026e3b4b82ef770f3cb7722c8c283ba744bf9a573b2c3e46"
        },
        {
          "byte_size": 5097,
          "path": "contracts/authoritative-evidence-quality.v1.schema.json",
          "sha256": "5360035bc9dd5e1a056d24befddcc6b9bed0438398196958f9aeeed131ef88ba"
        },
        {
          "byte_size": 15522,
          "path": "contracts/authoritative-navigator.v1.schema.json",
          "sha256": "baf7473bd3746adfaebf217d1fa00ebdd739bb37548a409e016254ed6170d499"
        },
        {
          "byte_size": 3672,
          "path": "contracts/authoritative-pack-core.v1.schema.json",
          "sha256": "f55709942e49b099f4c2d497983ce1217d70d435909dbf0784ea38f2b72255ce"
        },
        {
          "byte_size": 4345,
          "path": "contracts/authoritative-review-disposition.v1.schema.json",
          "sha256": "36a1c1cbec2d511b23161b34acf7887d6a33aed27ee9459c99723f6d9a6deee1"
        },
        {
          "byte_size": 5783,
          "path": "contracts/authoritative-source-quality-decision-matrix.v1.schema.json",
          "sha256": "66645dc9248d01a0c3d78b71bfb27e3410494c0b4dc93d24b7489c752118dbc3"
        },
        {
          "byte_size": 7198,
          "path": "contracts/authoritative-source-quality-decision-matrix.v2.schema.json",
          "sha256": "ac7071b20cb3d52da5b333ec558365ec2779ff4e7663897c8abd22622567bfd5"
        },
        {
          "byte_size": 3909,
          "path": "contracts/autonomous-query-plan.v1.schema.json",
          "sha256": "d037e81436187961d0c8275687ecf82c5a9cc03acc1f094060c65b76e93dfd93"
        },
        {
          "byte_size": 3262,
          "path": "contracts/autonomy-evaluation-report.v1.schema.json",
          "sha256": "3dd09a38c7e3db6d79affbca207196e976a01c65ea15bfbf70d2b3ecb0a5ed25"
        },
        {
          "byte_size": 2690,
          "path": "contracts/autonomy-evaluation-suite.v1.schema.json",
          "sha256": "40e5bce1dc9a2b5a81b76d8ec1920872716c69ed796086258146381ce27bef19"
        },
        {
          "byte_size": 1502,
          "path": "contracts/baseline-adapter-registry.v1.schema.json",
          "sha256": "84258313c80b83d16b3df1081129b7059dc2eef76ddcd218e645a1d29bf29dbf"
        },
        {
          "byte_size": 5215,
          "path": "contracts/baseline-evaluation-environment.v1.schema.json",
          "sha256": "05f9c5d30653d83a2809b593f698602ce93c54654435bcf8954874b9b727b0bf"
        },
        {
          "byte_size": 5583,
          "path": "contracts/baseline-evidence-collection-report.v1.schema.json",
          "sha256": "839100a3cffd476debc2216f1571cc013027b6d69187dd7a5d6660224693ec31"
        },
        {
          "byte_size": 1226,
          "path": "contracts/baseline-evidence-collection.v1.schema.json",
          "sha256": "e76f95080d196c129dd3c273db143c4550d29ba0e4b1a8f26f6e1d49450272f6"
        },
        {
          "byte_size": 1520,
          "path": "contracts/benchmark-corpus-commitment.v1.schema.json",
          "sha256": "9440c8792418c678d11fb8a9cb2cf78e9dff9f112ea3e977f34a1db73d4dfcd2"
        },
        {
          "byte_size": 787,
          "path": "contracts/catalog-signature.v1.schema.json",
          "sha256": "6077f5fc5e0f3412fccf250602f6bb7d8896ada4a1f315a6e8f1f5a928295134"
        },
        {
          "byte_size": 1037,
          "path": "contracts/catalog-trust.v1.schema.json",
          "sha256": "5fe00650702bc5a0ee55566cedda4c8c12763230f112c22cf0339c9168f92048"
        },
        {
          "byte_size": 2194,
          "path": "contracts/citation-audit.v1.schema.json",
          "sha256": "10248ed73dda2dcbefbdea1379693e645e35ce19d31b14e81555f2dd8b41cee6"
        },
        {
          "byte_size": 11311,
          "path": "contracts/codex-continuity-observation.v1.schema.json",
          "sha256": "bcbadb347f9d6d4568fe37029fa966e04ec94a6e25a4c702b42f38e56abc4de7"
        },
        {
          "byte_size": 13621,
          "path": "contracts/codex-continuity-qualification-report.v1.schema.json",
          "sha256": "374ba58658ff9312a72a8e76417cb32a02e373d418cec548a0ee30af4123dc35"
        },
        {
          "byte_size": 11315,
          "path": "contracts/codex-plugin-host-smoke.v1.schema.json",
          "sha256": "4d770eed7294f874ddc07c5ca5e3abf868e1301788e07dff9f0c4438f90c45c2"
        },
        {
          "byte_size": 3806,
          "path": "contracts/codex-token-attribution-evaluation.v1.schema.json",
          "sha256": "d09dc1f7a77351926b2449d7502c20ed08475387a22f9bf9bffc6212179d6fcd"
        },
        {
          "byte_size": 12669,
          "path": "contracts/codex-token-attribution-observation.v1.schema.json",
          "sha256": "c3dd37a3dc0b68009d9ddcd459eca32021f9d4c85e2c8b74e091cf1499630149"
        },
        {
          "byte_size": 10187,
          "path": "contracts/commercial-evidence-report.v1.schema.json",
          "sha256": "4782c2909ff1d4491e744f37c7bcd9112a5ce3d0801faaa867b573577abc27b3"
        },
        {
          "byte_size": 5862,
          "path": "contracts/commercial-evidence-report.v2.schema.json",
          "sha256": "0966f1c412fe220193d9dcad9b6be791b29ebb5d7ba730a1e774abda494c79ed"
        },
        {
          "byte_size": 2780,
          "path": "contracts/commercial-release-manifest.v1.schema.json",
          "sha256": "f90704dd078fd598d72bd7a76982890c03368abd4973cb52a857dc2eed282c77"
        },
        {
          "byte_size": 2865,
          "path": "contracts/commercial-release-manifest.v2.schema.json",
          "sha256": "972453d3e9a1c0fbcadbfc19ff80f2c67597e39a724e6c173ba81d5a4027fa09"
        },
        {
          "byte_size": 5083,
          "path": "contracts/commercial-release-manifest.v3.schema.json",
          "sha256": "5f764c1e19030034acf36305790bf715a251804266c890cbd3381ea993194915"
        },
        {
          "byte_size": 12148,
          "path": "contracts/commercial-release-manifest.v4.schema.json",
          "sha256": "3aa57d49bdf60105416fbf550e34f9ce494e3c6384e97ed7be4f403d194d25b1"
        },
        {
          "byte_size": 18195,
          "path": "contracts/commercial-release-manifest.v5.schema.json",
          "sha256": "c093ed0385835d26d264e277b801f0b54b48a0c0ac334484a5183134d7ef01ab"
        },
        {
          "byte_size": 6338,
          "path": "contracts/commercial-release-manifest.v6.schema.json",
          "sha256": "4d1411554ac6cc286f000d205b2346d9117860221a2aeb524f167b2ce6f6420a"
        },
        {
          "byte_size": 1863,
          "path": "contracts/corpus-release-manifest.v1.schema.json",
          "sha256": "07066685a807e0fccbb0e84f70c9f6b99d2acded5f74292101594b8dfe86b8c9"
        },
        {
          "byte_size": 2642,
          "path": "contracts/corpus-release-manifest.v2.schema.json",
          "sha256": "f95cfd24cf8d6f3aec05aa44ade06b7da3da24b2853e6e2bd40c536579e0ca78"
        },
        {
          "byte_size": 2876,
          "path": "contracts/corpus-release-manifest.v3.schema.json",
          "sha256": "c9c5136d7cc69a5edc2a3ca90ef8d69d5fe7ff78660206acae3f146eddacf71f"
        },
        {
          "byte_size": 4704,
          "path": "contracts/derived-manifest.v2.schema.json",
          "sha256": "95987b607bfdd2123b38a69a662bf24bacb77bb7d9de3ad54fa184af7233ada1"
        },
        {
          "byte_size": 1683,
          "path": "contracts/deterministic-fake-agent-compile.v1.schema.json",
          "sha256": "fb624b37a7d21b29bb5165554722ef048078c1ef938adc688f493f085337b982"
        },
        {
          "byte_size": 2137,
          "path": "contracts/deterministic-fake-agent-compile.v2.schema.json",
          "sha256": "42838c00aceca6341e51500f2f0d9397f3fc32042cf2128fb272bd80d6d7cb0b"
        },
        {
          "byte_size": 7644,
          "path": "contracts/deterministic-semantic-lifecycle.v1.schema.json",
          "sha256": "15f3d724d64f89e970320bc24f448c5c0d202145ff9aeab588414574b73fc7f1"
        },
        {
          "byte_size": 9745,
          "path": "contracts/deterministic-semantic-lifecycle.v2.schema.json",
          "sha256": "6dfa30a6f2a0434915d2551d6b7f327abc9f9894dd7aef6ab8a250a0dcbf2095"
        },
        {
          "byte_size": 1744,
          "path": "contracts/deterministic-semantic-source-run.v1.schema.json",
          "sha256": "bd88441eceecae0061ac25714e839df7d40d9d019c24ea1437c089c1d0dbaae3"
        },
        {
          "byte_size": 2931,
          "path": "contracts/deterministic-semantic-source-run.v2.schema.json",
          "sha256": "f25526c57353348584ac5a5948c51e9de4f6bc47356123ec49d545870da2d6cc"
        },
        {
          "byte_size": 5019,
          "path": "contracts/document-engine-actual-pdf-diagnostic.v1.schema.json",
          "sha256": "8829e7fb4299ddc336901d79be3458dbfa9bebbd6b0d1ad2e6a0e724eaf6940d"
        },
        {
          "byte_size": 4172,
          "path": "contracts/editor-context-envelope.v1.schema.json",
          "sha256": "16a6606edeb2b07a5e80abc6fb2208342dd92284a6d03651571e5d3d17f04150"
        },
        {
          "byte_size": 1575,
          "path": "contracts/editor-context-result.v1.schema.json",
          "sha256": "ab63e227df8b54bbd6ab800b214ab3cc1870f6f419ccc53bb4c04229b8f1f318"
        },
        {
          "byte_size": 7347,
          "path": "contracts/evaluation-protocol.v1.schema.json",